{
  "schema_version": 1,
  "event_id": "019e937b-3f6a-773a-845d-f13a3ac36bf5",
  "event_type": "handoff",
  "timestamp_utc": "2026-06-04T12:00:00Z",
  "tool": "manual",
  "aura": {
    "branch": "main",
    "sha": "4c0f549"
  },
  "sources": [],
  "proposed_workstreams": [
    {
      "name": "wiki-system",
      "relationship": "primary",
      "proposed_action": "update"
    }
  ],
  "summary": "Event with partial workstream_state",
  "status": "pending_garden",
  "workstream_state": {
    "current_state": ["In progress"],
    "next": ["Do more"]
  }
}
